<!ELEMENT configuracion (sitio_web+)>
<!ELEMENT sitio_web (nombre, dominio, tecnologias, secciones, servidor)>
<!ELEMENT nombre (#PCDATA)>
<!ELEMENT dominio (#PCDATA)>
<!ELEMENT tecnologias (tecnologia+)>
<!ELEMENT tecnologia (#PCDATA)>
<!ELEMENT secciones (seccion+)>
<!ELEMENT seccion (#PCDATA)>   
<!ELEMENT servidor (puerto, bbdd)> 
<!ELEMENT puerto (#PCDATA)>   
<!ELEMENT bbdd (#PCDATA)>